{"contextual_public_digest":{"algorithm":"sha256","value":"0f8cfa200263982b30a18569c3c8bc4a73626b6cf5d7fec024d27d3bb2e12601"},"evaluator_digest":{"algorithm":"sha256","value":"6a90d7d9bc56382c4fa61639eed146266157337acdd6a1ecc4ab16fdf06e70ca"},"rows":[{"accepted_delivery_attempt_id":"30ed3519-ef20-59d5-9cf8-5912510388fd","control_id":"SW-CA-C02","expected_decision":"deny","probe_id":"probe:decision:0dfae056-71c6-5101-b707-6f26f9e82346","request_id":"0dfae056-71c6-5101-b707-6f26f9e82346","required_policy_version_ids":["2718eb01-df5d-5694-a41d-33015a5ae010","b752a0bc-dd84-5b9c-afc9-8fe45a7fa417"],"synthetic":true,"trigger_event_id":"300a784e-982e-52e1-9dc0-17a30668be7e","truth_type":"access_decision"},{"accepted_delivery_attempt_id":"35e6055e-25be-57b7-8bda-da412856e34c","control_id":"SW-CA-C02","expected_decision":"deny","probe_id":"probe:decision:1466e3e3-ac93-5fef-8e27-41b60346a7c1","request_id":"1466e3e3-ac93-5fef-8e27-41b60346a7c1","required_policy_version_ids":["2718eb01-df5d-5694-a41d-33015a5ae010","b752a0bc-dd84-5b9c-afc9-8fe45a7fa417"],"synthetic":true,"trigger_event_id":"3456fae8-ce0f-5ae0-84b3-70c435bde77c","truth_type":"access_decision"},{"accepted_delivery_attempt_id":null,"control_id":"SW-CA-C02","expected_decision":"allow","probe_id":"probe:decision:266ca67e-4ab6-576c-a0a8-35ac6ef528b6","request_id":"266ca67e-4ab6-576c-a0a8-35ac6ef528b6","required_policy_version_ids":["2718eb01-df5d-5694-a41d-33015a5ae010","b752a0bc-dd84-5b9c-afc9-8fe45a7fa417"],"synthetic":true,"trigger_event_id":null,"truth_type":"access_decision"},{"accepted_delivery_attempt_id":null,"control_id":"SW-CA-C02","expected_decision":"deny","probe_id":"probe:decision:32355049-401c-5336-8694-df3844548ed8","request_id":"32355049-401c-5336-8694-df3844548ed8","required_policy_version_ids":["2718eb01-df5d-5694-a41d-33015a5ae010","b752a0bc-dd84-5b9c-afc9-8fe45a7fa417"],"synthetic":true,"trigger_event_id":null,"truth_type":"access_decision"},{"accepted_delivery_attempt_id":"f49a350b-03c4-5d80-bcfb-098e34f37925","control_id":"SW-CA-C02","expected_decision":"deny","probe_id":"probe:decision:432144a7-90db-5099-ad31-4eeab3ae432f","request_id":"432144a7-90db-5099-ad31-4eeab3ae432f","required_policy_version_ids":["2718eb01-df5d-5694-a41d-33015a5ae010","b752a0bc-dd84-5b9c-afc9-8fe45a7fa417"],"synthetic":true,"trigger_event_id":"101117d5-ed68-5487-a6e0-8a7163dd0a9f","truth_type":"access_decision"},{"accepted_delivery_attempt_id":"1f4ab460-a7b3-5c46-8fe8-ccd7f5249f85","control_id":"SW-CA-C02","expected_decision":"deny","probe_id":"probe:decision:521020ba-83c0-5b20-bcbe-245f4cd00f4e","request_id":"521020ba-83c0-5b20-bcbe-245f4cd00f4e","required_policy_version_ids":["2718eb01-df5d-5694-a41d-33015a5ae010","b752a0bc-dd84-5b9c-afc9-8fe45a7fa417"],"synthetic":true,"trigger_event_id":"29ff7032-58c9-5a0d-bc04-3099be0b19c3","truth_type":"access_decision"},{"accepted_delivery_attempt_id":null,"control_id":"SW-CA-C02","expected_decision":"deny","probe_id":"probe:decision:85b49a5e-9fbe-529e-a0cf-d12a3e4ec5c8","request_id":"85b49a5e-9fbe-529e-a0cf-d12a3e4ec5c8","required_policy_version_ids":["2718eb01-df5d-5694-a41d-33015a5ae010","b752a0bc-dd84-5b9c-afc9-8fe45a7fa417"],"synthetic":true,"trigger_event_id":null,"truth_type":"access_decision"},{"accepted_delivery_attempt_id":"20c794b9-f734-55f2-844f-516a0001e1e0","control_id":"SW-CA-C02","expected_decision":"deny","probe_id":"probe:decision:a8f2be95-b5bf-5bd0-a624-8f459f0f6ca7","request_id":"a8f2be95-b5bf-5bd0-a624-8f459f0f6ca7","required_policy_version_ids":["2718eb01-df5d-5694-a41d-33015a5ae010","b752a0bc-dd84-5b9c-afc9-8fe45a7fa417"],"synthetic":true,"trigger_event_id":"396a39e6-8fcb-5da8-8f80-333dbffbbd61","truth_type":"access_decision"},{"accepted_delivery_attempt_id":null,"control_id":"SW-CA-C02","expected_decision":"deny","probe_id":"probe:decision:cf3c46f9-1a6f-5533-9be1-897dea33a1cc","request_id":"cf3c46f9-1a6f-5533-9be1-897dea33a1cc","required_policy_version_ids":["2718eb01-df5d-5694-a41d-33015a5ae010","b752a0bc-dd84-5b9c-afc9-8fe45a7fa417"],"synthetic":true,"trigger_event_id":null,"truth_type":"access_decision"},{"accepted_delivery_attempt_id":"9ff206c0-5d3b-5dae-b308-e26efbc61e03","control_id":"SW-CA-C02","expected_decision":"allow","probe_id":"probe:decision:ebd16901-8625-5729-8986-ecf17440e5f4","request_id":"ebd16901-8625-5729-8986-ecf17440e5f4","required_policy_version_ids":["2718eb01-df5d-5694-a41d-33015a5ae010","b752a0bc-dd84-5b9c-afc9-8fe45a7fa417"],"synthetic":true,"trigger_event_id":"3138b0a7-f9e3-5e5d-a27b-77e18c588027","truth_type":"access_decision"},{"control_id":"SW-CA-C04","delivery_attempt_id":"1f4ab460-a7b3-5c46-8fe8-ccd7f5249f85","delivery_tick":5,"effective_tick":5,"event_id":"29ff7032-58c9-5a0d-bc04-3099be0b19c3","probe_id":"probe:delivery:1f4ab460-a7b3-5c46-8fe8-ccd7f5249f85","synthetic":true,"truth_type":"delivery_acceptance"},{"control_id":"SW-CA-C04","delivery_attempt_id":"20c794b9-f734-55f2-844f-516a0001e1e0","delivery_tick":10,"effective_tick":5,"event_id":"396a39e6-8fcb-5da8-8f80-333dbffbbd61","probe_id":"probe:delivery:20c794b9-f734-55f2-844f-516a0001e1e0","synthetic":true,"truth_type":"delivery_acceptance"},{"control_id":"SW-CA-C04","delivery_attempt_id":"30ed3519-ef20-59d5-9cf8-5912510388fd","delivery_tick":5,"effective_tick":5,"event_id":"300a784e-982e-52e1-9dc0-17a30668be7e","probe_id":"probe:delivery:30ed3519-ef20-59d5-9cf8-5912510388fd","synthetic":true,"truth_type":"delivery_acceptance"},{"control_id":"SW-CA-C04","delivery_attempt_id":"35e6055e-25be-57b7-8bda-da412856e34c","delivery_tick":5,"effective_tick":5,"event_id":"3456fae8-ce0f-5ae0-84b3-70c435bde77c","probe_id":"probe:delivery:35e6055e-25be-57b7-8bda-da412856e34c","synthetic":true,"truth_type":"delivery_acceptance"},{"control_id":"SW-CA-C04","delivery_attempt_id":"8bd879ae-e736-5477-92f6-e26542ed4b15","delivery_tick":7,"effective_tick":6,"event_id":"53d80d09-3985-5789-924d-aaab315dfda2","probe_id":"probe:delivery:8bd879ae-e736-5477-92f6-e26542ed4b15","synthetic":true,"truth_type":"delivery_acceptance"},{"control_id":"SW-CA-C04","delivery_attempt_id":"9ff206c0-5d3b-5dae-b308-e26efbc61e03","delivery_tick":7,"effective_tick":5,"event_id":"3138b0a7-f9e3-5e5d-a27b-77e18c588027","probe_id":"probe:delivery:9ff206c0-5d3b-5dae-b308-e26efbc61e03","synthetic":true,"truth_type":"delivery_acceptance"},{"control_id":"SW-CA-C04","delivery_attempt_id":"c8f147ea-b6e3-5671-b820-e0a3eb6e79b7","delivery_tick":6,"effective_tick":5,"event_id":"101117d5-ed68-5487-a6e0-8a7163dd0a9f","probe_id":"probe:delivery:c8f147ea-b6e3-5671-b820-e0a3eb6e79b7","synthetic":true,"truth_type":"delivery_acceptance"},{"control_id":"SW-CA-C04","delivery_attempt_id":"f49a350b-03c4-5d80-bcfb-098e34f37925","delivery_tick":5,"effective_tick":5,"event_id":"101117d5-ed68-5487-a6e0-8a7163dd0a9f","probe_id":"probe:delivery:f49a350b-03c4-5d80-bcfb-098e34f37925","synthetic":true,"truth_type":"delivery_acceptance"},{"control_id":"SW-CA-C03","expected_decision":"deny","expected_side_effect":"not_observed","probe_id":"probe:enforcement:0dfae056-71c6-5101-b707-6f26f9e82346","request_id":"0dfae056-71c6-5101-b707-6f26f9e82346","synthetic":true,"truth_type":"protected_enforcement"},{"control_id":"SW-CA-C03","expected_decision":"deny","expected_side_effect":"not_observed","probe_id":"probe:enforcement:1466e3e3-ac93-5fef-8e27-41b60346a7c1","request_id":"1466e3e3-ac93-5fef-8e27-41b60346a7c1","synthetic":true,"truth_type":"protected_enforcement"},{"control_id":"SW-CA-C03","expected_decision":"allow","expected_side_effect":"occurred","probe_id":"probe:enforcement:266ca67e-4ab6-576c-a0a8-35ac6ef528b6","request_id":"266ca67e-4ab6-576c-a0a8-35ac6ef528b6","synthetic":true,"truth_type":"protected_enforcement"},{"control_id":"SW-CA-C03","expected_decision":"deny","expected_side_effect":"not_observed","probe_id":"probe:enforcement:32355049-401c-5336-8694-df3844548ed8","request_id":"32355049-401c-5336-8694-df3844548ed8","synthetic":true,"truth_type":"protected_enforcement"},{"control_id":"SW-CA-C03","expected_decision":"deny","expected_side_effect":"not_observed","probe_id":"probe:enforcement:432144a7-90db-5099-ad31-4eeab3ae432f","request_id":"432144a7-90db-5099-ad31-4eeab3ae432f","synthetic":true,"truth_type":"protected_enforcement"},{"control_id":"SW-CA-C03","expected_decision":"deny","expected_side_effect":"not_observed","probe_id":"probe:enforcement:521020ba-83c0-5b20-bcbe-245f4cd00f4e","request_id":"521020ba-83c0-5b20-bcbe-245f4cd00f4e","synthetic":true,"truth_type":"protected_enforcement"},{"control_id":"SW-CA-C03","expected_decision":"deny","expected_side_effect":"not_observed","probe_id":"probe:enforcement:85b49a5e-9fbe-529e-a0cf-d12a3e4ec5c8","request_id":"85b49a5e-9fbe-529e-a0cf-d12a3e4ec5c8","synthetic":true,"truth_type":"protected_enforcement"},{"control_id":"SW-CA-C03","expected_decision":"deny","expected_side_effect":"not_observed","probe_id":"probe:enforcement:a8f2be95-b5bf-5bd0-a624-8f459f0f6ca7","request_id":"a8f2be95-b5bf-5bd0-a624-8f459f0f6ca7","synthetic":true,"truth_type":"protected_enforcement"},{"control_id":"SW-CA-C03","expected_decision":"deny","expected_side_effect":"not_observed","probe_id":"probe:enforcement:cf3c46f9-1a6f-5533-9be1-897dea33a1cc","request_id":"cf3c46f9-1a6f-5533-9be1-897dea33a1cc","synthetic":true,"truth_type":"protected_enforcement"},{"control_id":"SW-CA-C03","expected_decision":"allow","expected_side_effect":"occurred","probe_id":"probe:enforcement:ebd16901-8625-5729-8986-ecf17440e5f4","request_id":"ebd16901-8625-5729-8986-ecf17440e5f4","synthetic":true,"truth_type":"protected_enforcement"},{"control_id":"SW-CA-C06","probe_id":"probe:evidence:0dfae056-71c6-5101-b707-6f26f9e82346","request_id":"0dfae056-71c6-5101-b707-6f26f9e82346","required_evidence_kind":"trace","synthetic":true,"truth_type":"evidence_correlation"},{"control_id":"SW-CA-C06","probe_id":"probe:evidence:1466e3e3-ac93-5fef-8e27-41b60346a7c1","request_id":"1466e3e3-ac93-5fef-8e27-41b60346a7c1","required_evidence_kind":"trace","synthetic":true,"truth_type":"evidence_correlation"